{
  "schemaVersion": "1.0.0",
  "date": "2026-10-24",
  "generatedAt": "2026-10-24T08:35:00+07:00",
  "briefKind": "eod_prev+overnight+preopen",
  "items": [
    {
      "id": "n-2026-10-24-001",
      "impact": "high",
      "impactScore": 92,
      "rank": 1,
      "kind": "market",
      "board": "vn",
      "title": "VN-Index đóng 1.774,15 (+0,77%), phiên thứ 4 liên tiếp tăng",
      "url": "https://en.nhandan.vn/infographic-vn-index-up-077-on-october-23-post168136.html",
      "sourceId": "src-vietstock",
      "publishedAt": "2026-10-23T16:36:00+07:00",
      "tickers": ["VNINDEX"],
      "excerpt": "Bù cả tháng giảm, thanh khoản cải thiện.",
      "whyImpact": "Print chính thức khóa nhiều nguồn."
    },
    {
      "id": "n-2026-10-24-002",
      "impact": "high",
      "impactScore": 88,
      "rank": 2,
      "kind": "market",
      "board": "vn",
      "title": "Khối ngoại bán ròng ~478 tỷ HOSE",
      "url": "http://en.stockbiz.vn/HistoricalIndices.aspx",
      "sourceId": "src-stockbiz",
      "publishedAt": "2026-10-23T15:30:00+07:00",
      "tickers": ["ACB", "FPT"],
      "excerpt": "Buy 1.897 / Sell 2.375 tỷ.",
      "whyImpact": "Dòng ngoại đảo chiều bán."
    },
    {
      "id": "n-2026-10-24-003",
      "impact": "high",
      "impactScore": 85,
      "rank": 3,
      "kind": "news",
      "board": "global",
      "title": "Dow giảm 1,23%, S&P -0,52% cuối tuần",
      "url": "https://www.reuters.com/business/wall-street-futures-dip-after-ai-rout-telecoms-slide-2026-10-23/",
      "sourceId": "src-bloomberg",
      "publishedAt": "2026-10-23T17:43:00+07:00",
      "tickers": [],
      "excerpt": "Dầu tăng, telecom giảm.",
      "whyImpact": "Risk-off overnight."
    },
    {
      "id": "n-2026-10-24-004",
      "impact": "medium",
      "impactScore": 75,
      "rank": 4,
      "kind": "market",
      "board": "vn",
      "title": "STB tăng trần, bank dẫn dắt",
      "url": "https://baodautu.vn/chung-khoan-phien-2310-vn-index-tang-phien-thu-4-lien-tiep-d729602.html",
      "sourceId": "src-cafef",
      "publishedAt": "2026-10-23T15:49:00+07:00",
      "tickers": ["STB", "ACB"],
      "excerpt": "VIC kéo 5,76 điểm.",
      "whyImpact": "Sector bank mạnh."
    },
    {
      "id": "n-2026-10-24-005",
      "impact": "medium",
      "impactScore": 72,
      "rank": 5,
      "kind": "news",
      "board": "global",
      "title": "Vàng trượt dưới 4.000 USD",
      "url": "https://www.nationthailand.com/business/trading-investment/40072669",
      "sourceId": "src-barrons",
      "publishedAt": "2026-10-24T07:41:00+07:00",
      "tickers": [],
      "excerpt": "Giảm mạnh nhất tuần.",
      "whyImpact": "Kỳ vọng lãi suất."
    },
    {
      "id": "n-2026-10-24-006",
      "impact": "medium",
      "impactScore": 70,
      "rank": 6,
      "kind": "news",
      "board": "global",
      "title": "Hang Seng tăng 0,69% lên 23.093",
      "url": "https://english.news.cn/20261023/4d6864cb9c724576ab16cbee32347f73/c.html",
      "sourceId": "src-bloomberg",
      "publishedAt": "2026-10-23T17:15:00+07:00",
      "tickers": [],
      "excerpt": "Tech HK hồi.",
      "whyImpact": "Asia mixed."
    },
    {
      "id": "n-2026-10-24-007",
      "impact": "medium",
      "impactScore": 68,
      "rank": 7,
      "kind": "news",
      "board": "global",
      "title": "Nikkei giảm 0,34% xuống 62.693",
      "url": "https://en.kabutan.com/jp/news/n202610230862",
      "sourceId": "src-bloomberg",
      "publishedAt": "2026-10-23T15:32:00+07:00",
      "tickers": [],
      "excerpt": "Breadth yếu.",
      "whyImpact": "Lạm phát Nhật."
    },
    {
      "id": "n-2026-10-24-008",
      "impact": "low",
      "impactScore": 55,
      "rank": 8,
      "kind": "market",
      "board": "vn",
      "title": "Thanh khoản HoSE ~16.942 tỷ",
      "url": "https://vneconomy.vn/tang-ba-phien-bu-ca-thang-giam-vn-index-vuot-1770-diem.htm",
      "sourceId": "src-vneconomy",
      "publishedAt": "2026-10-23T15:26:00+07:00",
      "tickers": [],
      "excerpt": "Chiều tăng 72%.",
      "whyImpact": "Liquidity cải thiện."
    },
    {
      "id": "n-2026-10-24-009",
      "impact": "low",
      "impactScore": 40,
      "rank": 9,
      "kind": "community",
      "board": "vn",
      "title": "Cộng đồng theo dõi bank và VIC",
      "url": "https://fireant.vn/cong-dong/moi-nhat",
      "sourceId": "src-fireant",
      "publishedAt": "2026-10-23T20:00:00+07:00",
      "tickers": ["STB"],
      "excerpt": "Sentiment tích cực trên bank.",
      "whyImpact": "Color only."
    },
    {
      "id": "n-2026-10-24-010",
      "impact": "low",
      "impactScore": 35,
      "rank": 10,
      "kind": "community",
      "board": "vn",
      "title": "newF319 thin trên dòng ngoại",
      "url": "https://newf319.com/",
      "sourceId": "src-newf319",
      "publishedAt": "2026-10-23T21:00:00+07:00",
      "tickers": [],
      "excerpt": "Ít thảo luận cụ thể.",
      "whyImpact": "Sentiment color."
    }
  ]
}
