{
  "schemaVersion": "1.0.0",
  "date": "2026-10-30",
  "generatedAt": "2026-10-30T08:35:00+07:00",
  "briefKind": "eod_prev+overnight+preopen",
  "items": [
    {
      "id": "n-2026-10-30-001",
      "impact": "high",
      "impactScore": 92,
      "rank": 1,
      "kind": "market",
      "board": "vn",
      "title": "VN-Index đóng 29/10 tại 1.755,61 (-0,62%)",
      "url": "https://stockbiz.vn/en/stocks/VNINDEX",
      "sourceId": "src-stockbiz",
      "publishedAt": "2026-10-29T16:00:00+07:00",
      "tickers": ["VNINDEX"],
      "excerpt": "Volume 637m, giá trị 14.505 tỷ. Độ rộng âm.",
      "whyImpact": "In số chính thức phiên trước; xác định mốc mở cửa 30/10."
    },
    {
      "id": "n-2026-10-30-002",
      "impact": "high",
      "impactScore": 88,
      "rank": 2,
      "kind": "market",
      "board": "vn",
      "title": "Ngoại bán ròng ~457 tỷ HoSE phiên 29/10",
      "url": "https://nhandan.vn/infographic-chung-khoan-ngay-2910-vn-index-giam-hon-11-diem-khoi-ngoai-van-ban-rong-post998952.html",
      "sourceId": "src-stockbiz",
      "publishedAt": "2026-10-29T19:32:00+07:00",
      "tickers": ["TCB", "MSN"],
      "excerpt": "Bán ròng tiếp tục; TCB nổi bật.",
      "whyImpact": "Dòng ngoại quyết định áp lực mở cửa."
    },
    {
      "id": "n-2026-10-30-003",
      "impact": "high",
      "impactScore": 85,
      "rank": 3,
      "kind": "market",
      "board": "vn",
      "title": "Tự doanh bán ròng 284,8 tỷ (nmquan)",
      "url": "https://nmquan.vn/data/tu-doanh/lich-su",
      "sourceId": "src-vneconomy",
      "publishedAt": "2026-10-30T08:04:00+07:00",
      "tickers": ["TCB", "GAS"],
      "excerpt": "Đảo chiều sau mua phiên trước. TCB -88,5.",
      "whyImpact": "Nội địa xác nhận bán."
    },
    {
      "id": "n-2026-10-30-004",
      "impact": "high",
      "impactScore": 80,
      "rank": 4,
      "kind": "news",
      "board": "global",
      "title": "US close 29/10: S&P -0,30%, Nasdaq -1,38%",
      "url": "https://www.cnbc.com/2026/10/28/stock-market-today-live-updates.html",
      "sourceId": "src-bloomberg",
      "publishedAt": "2026-10-29T20:00:00+07:00",
      "tickers": [],
      "excerpt": "Alphabet kéo Nasdaq. Dow -0,25% 52.342.",
      "whyImpact": "Overnight risk-off tech truyền sang VN."
    },
    {
      "id": "n-2026-10-30-005",
      "impact": "medium",
      "impactScore": 70,
      "rank": 5,
      "kind": "news",
      "board": "global",
      "title": "Nikkei +1,10% 64.659; HSI -0,59%",
      "url": "https://news.rthk.hk/rthk/en/component/k2/1875803-20261029.htm",
      "sourceId": "src-bloomberg",
      "publishedAt": "2026-10-29T17:00:00+07:00",
      "tickers": [],
      "excerpt": "Châu Á hỗn hợp; tech HK yếu.",
      "whyImpact": "Tín hiệu khu vực trung tính."
    },
    {
      "id": "n-2026-10-30-006",
      "impact": "medium",
      "impactScore": 65,
      "rank": 6,
      "kind": "macro",
      "board": "vn",
      "title": "Tỷ giá trung tâm 25.644 VND/USD",
      "url": "https://sbv.gov.vn/",
      "sourceId": "src-nhnn",
      "publishedAt": "2026-10-29T09:00:00+07:00",
      "tickers": [],
      "excerpt": "Tăng 13 đồng.",
      "whyImpact": "FX ổn định, không đảo chiều."
    },
    {
      "id": "n-2026-10-30-007",
      "impact": "medium",
      "impactScore": 60,
      "rank": 7,
      "kind": "news",
      "board": "global",
      "title": "DXY ~101,85 (-0,33%)",
      "url": "https://www.barrons.com/market-data",
      "sourceId": "src-barrons",
      "publishedAt": "2026-10-29T22:00:00+07:00",
      "tickers": [],
      "excerpt": "Dollar giảm nhẹ.",
      "whyImpact": "USD không tạo áp lực mới."
    },
    {
      "id": "n-2026-10-30-008",
      "impact": "low",
      "impactScore": 40,
      "rank": 8,
      "kind": "community",
      "board": "vn",
      "title": "FireAnt / F247 / newF319 mỏng",
      "url": "https://fireant.vn/cong-dong/moi-nhat",
      "sourceId": "src-fireant",
      "publishedAt": "2026-10-30T07:30:00+07:00",
      "tickers": [],
      "excerpt": "Ít thảo luận mới.",
      "whyImpact": "Sentiment không mâu thuẫn tape."
    }
  ]
}
