{
  "schemaVersion": "1.0.0",
  "date": "2026-10-01",
  "generatedAt": "2026-10-01T08:35:00+07:00",
  "briefKind": "eod_prev+overnight+preopen",
  "items": [
    {"id": "n-2026-10-01-001", "impact": "high", "impactScore": 92, "rank": 1, "kind": "market", "board": "vn", "title": "VN-Index đóng 1.768,62 (−9,11đ, −0,51%) phiên 30/9", "url": "http://en.stockbiz.vn/HistoricalIndices.aspx", "sourceId": "src-stockbiz", "publishedAt": "2026-09-30T15:00:00+07:00", "tickers": ["VNINDEX"], "excerpt": "StockBiz: 650,4 triệu cp / 15.230,5 tỷ. 129 tăng / 178 giảm.", "whyImpact": "EOD chính thức trước phiên 1/10; BSC nói thủng SMA50."},
    {"id": "n-2026-10-01-002", "impact": "high", "impactScore": 90, "rank": 2, "kind": "market", "board": "vn", "title": "Ngoại bán ròng ~890 tỷ HoSE, tâm điểm VHM −329 tỷ", "url": "http://en.stockbiz.vn/HistoricalIndices.aspx", "sourceId": "src-stockbiz", "publishedAt": "2026-09-30T15:00:00+07:00", "tickers": ["VHM", "TCB", "VIC", "PNJ", "VPB"], "excerpt": "Mua 1.001 / bán 1.891 tỷ. TCB −156, VIC −82, PNJ −62, VPB −57.", "whyImpact": "Dòng ngoại quyết định trụ họ Vin và ngân hàng."},
    {"id": "n-2026-10-01-003", "impact": "high", "impactScore": 84, "rank": 3, "kind": "news", "board": "global", "title": "Dow −0,86% xuống 50.906; 10Y Mỹ ~5,30%", "url": "https://www.barrons.com/market-data", "sourceId": "src-barrons", "publishedAt": "2026-09-30T16:00:00-04:00", "tickers": ["DJI", "SPX"], "excerpt": "S&P 7.651,54 (−0,25%); NDX +0,23%; VIX 16,34.", "whyImpact": "Overnight risk-off blue-chip Mỹ trước open VN."},
    {"id": "n-2026-10-01-004", "impact": "high", "impactScore": 82, "rank": 4, "kind": "disclosure", "board": "vn", "title": "NVL chốt ĐKCC quyền mua ~801 triệu cp ngày 1/10", "url": "https://cafef.vn/novaland-nvl-chot-ngay-phat-hanh-gan-801-trieu-co-phieu-huy-dong-hon-8000-ty-dong-xu-ly-no-188260921221505758.chn", "sourceId": "src-cafef", "publishedAt": "2026-09-21T22:15:00+07:00", "tickers": ["NVL"], "excerpt": "Giá 10.000đ; nộp tiền 8–29/10; vốn điều lệ lên >32.000 tỷ nếu thành công.", "whyImpact": "Sự kiện quyền hôm nay, dư bán midcap."},
    {"id": "n-2026-10-01-005", "impact": "medium", "impactScore": 76, "rank": 5, "kind": "market", "board": "vn", "title": "BSC: VIC/VHM/GAS/BSR kéo chỉ số xuống", "url": "https://www.bsc.com.vn/en/bao-cao/15983-bsc-brief-30-09-vn-index-falls-below-sma50-downside-risks-increase", "sourceId": "src-vietstock", "publishedAt": "2026-09-30T17:38:00+07:00", "tickers": ["VIC", "VHM", "GAS", "BSR"], "excerpt": "VIC −3,38đ; VHM −2,20; GAS −1,42; BSR −1,12. Đỡ: VPB, GEE, CTG.", "whyImpact": "Tập trung trụ giải thích điểm số."},
    {"id": "n-2026-10-01-006", "impact": "medium", "impactScore": 74, "rank": 6, "kind": "disclosure", "board": "vn", "title": "PNJ trình phát hành riêng lẻ tối đa 550 triệu cp", "url": "https://cafef.vn/pnj-muon-phat-hanh-rieng-le-toi-da-550-trieu-co-phieu-dong-thoi-hoan-nhap-hon-4600-ty-dong-188260930084249444.chn", "sourceId": "src-cafef", "publishedAt": "2026-09-30T15:44:00+07:00", "tickers": ["PNJ"], "excerpt": "Hoàn nhập quỹ ĐTPT >4.602 tỷ. Ngoại đã bán PNJ −62 tỷ phiên 30/9.", "whyImpact": "Pha loãng + dư bán chồng lên nhau."},
    {"id": "n-2026-10-01-007", "impact": "medium", "impactScore": 70, "rank": 7, "kind": "news", "board": "global", "title": "Nikkei +1,94% lên 66.753,72", "url": "https://www.barrons.com/market-data", "sourceId": "src-barrons", "publishedAt": "2026-09-30T15:00:00+09:00", "tickers": ["NKY", "HSI"], "excerpt": "HSI ~24.613 (+0,37%). Á không đồng pha với Dow.", "whyImpact": "Truyền dẫn Á sáng 1/10 hỗn hợp."},
    {"id": "n-2026-10-01-008", "impact": "medium", "impactScore": 68, "rank": 8, "kind": "macro", "board": "global", "title": "DXY 101,47; WTI 89,98 USD", "url": "https://www.barrons.com/market-data", "sourceId": "src-barrons", "publishedAt": "2026-09-30T20:01:00+07:00", "tickers": ["DXY", "WTI"], "excerpt": "GDP Mỹ Q2 lần 3 +2,2%; ADP +90 nghìn. USD cứng.", "whyImpact": "Tỷ giá và dầu là kênh truyền vào VN."},
    {"id": "n-2026-10-01-009", "impact": "medium", "impactScore": 64, "rank": 9, "kind": "macro", "board": "vn", "title": "Tỷ giá trung tâm 25.632; NHTM bán ~26.160", "url": "https://www.sbv.gov.vn/", "sourceId": "src-nhnn", "publishedAt": "2026-09-27T00:00:00+07:00", "tickers": ["USDVND"], "excerpt": "SBV công bố 25.632 (27/9). VnEconomy: USD bán VCB 26.160.", "whyImpact": "Ổn định tỷ giá nhưng DXY cao."},
    {"id": "n-2026-10-01-010", "impact": "medium", "impactScore": 62, "rank": 10, "kind": "news", "board": "vn", "title": "SSI: KQKD Q3 phân hóa mạnh", "url": "https://cafef.vn/ssi-du-bao-buc-tranh-loi-nhuan-quy-3-bon-doanh-nghiep-tang-bang-lan-mot-ngan-hang-co-the-sut-giam-188260929144422502.chn", "sourceId": "src-cafef", "publishedAt": "2026-09-29T21:47:00+07:00", "tickers": ["VGC", "MSN", "PHR", "NT2", "STB"], "excerpt": "VGC +183%, MSN +125%; STB có thể −45% vì dự phòng.", "whyImpact": "Chất xúc tác riêng lẻ tháng 10."},
    {"id": "n-2026-10-01-011", "impact": "medium", "impactScore": 58, "rank": 11, "kind": "community", "board": "vn", "title": "FireAnt: tự doanh +~1.200 tỷ phiên 30/9, gom VPB", "url": "https://web.fireant.vn/ma-chung-khoan/VNINDEX", "sourceId": "src-fireant", "publishedAt": "2026-09-30T16:32:00+07:00", "tickers": ["VPB"], "excerpt": "Cộng đồng ghi nhận tự doanh lệch chiều ngoại; tone thận trọng vì mất điểm cuối phiên.", "whyImpact": "Sentiment nội, không phải print HOSE."},
    {"id": "n-2026-10-01-012", "impact": "low", "impactScore": 45, "rank": 12, "kind": "community", "board": "vn", "title": "newF319/F247: tone phòng thủ sau chuỗi giảm cuối tháng", "url": "https://newf319.com/", "sourceId": "src-newf319", "publishedAt": "2026-10-01T08:00:00+07:00", "tickers": ["VNINDEX"], "excerpt": "Diễn đàn kế nhiệm F319: quan sát 1.760 hơn là bắt đáy rộng.", "whyImpact": "Màu sắc cộng đồng, không thay thế dòng tiền."},
    {"id": "n-2026-10-01-013", "impact": "low", "impactScore": 42, "rank": 13, "kind": "news", "board": "global", "title": "Bitcoin ~83.678 USD; ETH ~2.685", "url": "https://finance.yahoo.com/quote/BTC-USD/", "sourceId": "src-yahoo-btc", "publishedAt": "2026-10-01T08:00:00+07:00", "tickers": ["BTC"], "excerpt": "Crypto đi ngang khi lợi suất thực cao.", "whyImpact": "Ít truyền trực tiếp vào VN-Index."},
    {"id": "n-2026-10-01-014", "impact": "low", "impactScore": 40, "rank": 14, "kind": "macro", "board": "vn", "title": "CPI 8 tháng +4,45%; YoY T8 +4,89%", "url": "https://en.vneconomy.vn/vietnams-cpi-rises-445-in-first-eight-months-of-2026.htm", "sourceId": "src-vneconomy", "publishedAt": "2026-09-03T15:35:00+07:00", "tickers": [], "excerpt": "NSO: nhà ở–điện–xăng và thực phẩm dẫn dắt.", "whyImpact": "Nền vĩ mô, không phải print phiên."}
  ]
}
